{
  "id": "rfi-deck-agent",
  "version": "0.2.0",
  "hostVersion": "3.2.4",
  "RevitVersion": ["2024"],
  "assembly": "RfiDeckAgent.dll",
  "entryClass": "RfiDeckAgent.Commands.OpenCommand",
  "ToolId": "DT_RfiDeckAgent",
  "Ribbon": {"name": "RfiDeckAgent", "text": "釋疑簡報", "category": "review"},
  "permissions": ["ribbon-command"],
  "dependencies": [],
  "tests": [
    "Revit 2024：RTS › 檢討與管理 出現「釋疑簡報」，未授權 ToolId 被擋下",
    "Revit 2024：未設定 AI AGENT 資料夾時先開啟設定",
    "Revit 2024：釋疑擷取截圖成功，樓層／柱線／選取元件正確，模型未被修改",
    "Revit 2024：產生簡報輸出 PPT 可開啟；收件匣、成果資料夾、共用簡報可開啟",
    "Revit 2024：選取結構柱／梁擷取，對照圖說為整張結構與建築平面圖（含圖框），紅圈落在選取構件位置",
    "Revit 2024：接續舊草稿時，有選取元件則位置欄位與對照圖說改用這次的；草稿超過 2 小時會先詢問",
    "Revit 2024：AI AGENT 資料夾沒有 seek_lookup.py 時，找對照圖說仍可執行（使用 DLL 內嵌版本，寫到 %LOCALAPPDATA%\\DT_AIAgent\\py）",
    "回退：移除模組資料夾後重建，原有功能正常"
  ]
}
